{
  "id": "IMPL-001",
  "type": "implementation_notes",
  "project": "",
  "implementation_slice": "",
  "approved_scope_implemented": [],
  "files_areas_changed": [],
  "behavior_added_or_changed": [],
  "verification_performed": [],
  "human_feedback_requested": [],
  "known_issues": [],
  "deferred_items": []
}
